{
  "$schema": "/design-system/schemas/channel-catalog.schema.json",
  "schemaVersion": "1.0.0",
  "version": "0.4.0",
  "brandVersionId": "wonka-brand-v0.1.0",
  "channels": [
    {
      "$schema": "/design-system/schemas/channel.schema.json",
      "schemaVersion": "1.0.0",
      "id": "channel.product",
      "name": "Product",
      "description": "Task-oriented interfaces for Wonka products, internal tools, and agent workspaces.",
      "aliases": [
        "product",
        "app"
      ],
      "lifecycle": "review_required",
      "stability": "beta",
      "introducedIn": "0.2.0",
      "allowedThemes": [
        "light",
        "dark"
      ],
      "distribution": "external",
      "tokenSets": [
        "color",
        "semantic.color",
        "radius",
        "shadow",
        "typography",
        "motion",
        "component"
      ],
      "compatibleAssetIds": [
        "asset.logo.wordmark",
        "asset.logo.mark",
        "asset.font.inter-display",
        "asset.font.gt-sectra",
        "asset.logo.full",
        "asset.logo.lockup",
        "asset.logo.wordmark-ai"
      ],
      "constraints": [
        {
          "id": "responsive",
          "value": "Support 320px through large desktop layouts without horizontal scrolling.",
          "level": "required",
          "enforcement": "contract"
        },
        {
          "id": "accessibility",
          "value": "Text and visible focus indicators meet their WCAG 2.2 AA contrast thresholds.",
          "level": "required",
          "enforcement": "automated",
          "ruleId": "rule.contrast-aa"
        },
        {
          "id": "keyboard",
          "value": "Every interactive flow remains operable with a keyboard and retains visible focus.",
          "level": "required",
          "enforcement": "contract"
        },
        {
          "id": "reduced-motion",
          "value": "Non-essential motion respects the user’s reduced-motion preference.",
          "level": "required",
          "enforcement": "contract"
        },
        {
          "id": "interface-states",
          "value": "Interactive elements define loading, empty, error, disabled, focus, and success states where applicable.",
          "level": "required",
          "enforcement": "contract"
        },
        {
          "id": "distribution",
          "value": "Treat Product as externally distributed by default. Internal-only surfaces require a dedicated channel before verified_internal assets can be selected.",
          "level": "required",
          "enforcement": "contract"
        }
      ],
      "exportTargets": [
        "react",
        "css",
        "html"
      ],
      "provenance": {
        "source": "Wonka product primitives",
        "owner": "Wonka Design System",
        "approvedBy": null,
        "approvedAt": null
      },
      "compatibleComponentIds": [
        "component.button",
        "component.badge",
        "component.surface",
        "component.eyebrow",
        "component.logo",
        "component.logo-mark",
        "component.product.product-theme",
        "component.product.action-button",
        "component.product.icon",
        "component.product.identity-avatar",
        "component.product.panel",
        "component.product.field",
        "component.product.toggle",
        "component.product.tag",
        "component.product.search-input",
        "component.product.state-notice",
        "component.product.product-dialog",
        "component.product.motion-stage",
        "component.product.connector-card",
        "component.product.connector-configuration",
        "component.product.connector-authorization",
        "component.product.connector-catalog",
        "component.product.template-card",
        "component.product.template-gallery",
        "component.product.template-detail",
        "component.product.builder-section",
        "component.product.agent-builder-header",
        "component.product.model-picker",
        "component.product.skill-picker",
        "component.product.tool-picker",
        "component.product.knowledge-files",
        "component.product.schedule-editor",
        "component.product.version-history",
        "component.product.agent-builder",
        "component.product.product-shell",
        "component.product.product-agent-card",
        "component.product.agent-library",
        "component.product.chat-composer",
        "component.product.execution-trace",
        "component.product.source-citation",
        "component.product.chat-message",
        "component.product.deliverable-preview",
        "component.product.sharing-panel",
        "component.product.settings-navigation",
        "component.product.members-table",
        "component.product.resource-table",
        "component.product.usage-overview",
        "component.product.settings-panel",
        "component.product.settings-workspace",
        "component.product.skill-card",
        "component.product.skill-library",
        "component.product.skill-detail",
        "component.product.onboarding-checklist",
        "component.product.approval-card",
        "component.product.workflow-runs",
        "component.product.prompt-library",
        "component.product.notification-toast"
      ]
    },
    {
      "$schema": "/design-system/schemas/channel.schema.json",
      "schemaVersion": "1.0.0",
      "id": "channel.website",
      "name": "Website",
      "description": "Editorial and conversion-oriented browser experiences built from Wonka’s shared foundations.",
      "aliases": [
        "website",
        "web"
      ],
      "lifecycle": "review_required",
      "stability": "beta",
      "introducedIn": "0.2.0",
      "allowedThemes": [
        "light",
        "dark"
      ],
      "distribution": "external",
      "tokenSets": [
        "color",
        "semantic.color",
        "radius",
        "shadow",
        "typography",
        "motion",
        "component"
      ],
      "compatibleAssetIds": [
        "asset.logo.wordmark",
        "asset.logo.mark",
        "asset.font.inter-display",
        "asset.font.gt-sectra",
        "asset.logo.full",
        "asset.logo.lockup",
        "asset.logo.wordmark-ai",
        "asset.image.color-palette",
        "asset.image.color-plate",
        "asset.image.watermark",
        "asset.image.background",
        "asset.image.avatar",
        "asset.image.logo-card",
        "asset.image.window-icon",
        "asset.image.window-wordmark",
        "asset.image.glass-icon",
        "asset.image.caption-styles",
        "asset.video.logo-reveal",
        "asset.video.icon-loop",
        "asset.video.bar-wipe",
        "asset.video.end-card",
        "asset.video.painted-loop"
      ],
      "constraints": [
        {
          "id": "responsive",
          "value": "Support 320px through large desktop layouts without horizontal scrolling.",
          "level": "required",
          "enforcement": "contract"
        },
        {
          "id": "accessibility",
          "value": "Text and visible focus indicators meet their WCAG 2.2 AA contrast thresholds.",
          "level": "required",
          "enforcement": "automated",
          "ruleId": "rule.contrast-aa"
        },
        {
          "id": "keyboard",
          "value": "Every interactive flow remains operable with a keyboard and retains visible focus.",
          "level": "required",
          "enforcement": "contract"
        },
        {
          "id": "reduced-motion",
          "value": "Non-essential motion respects the user’s reduced-motion preference.",
          "level": "required",
          "enforcement": "contract"
        },
        {
          "id": "explicit-actions",
          "value": "Use real product language and explicit action labels.",
          "level": "required",
          "enforcement": "human_review"
        }
      ],
      "exportTargets": [
        "react",
        "css",
        "html",
        "png",
        "pdf"
      ],
      "provenance": {
        "source": "Wonka website primitives",
        "owner": "Wonka Design System",
        "approvedBy": null,
        "approvedAt": null
      },
      "compatibleComponentIds": [
        "component.button",
        "component.badge",
        "component.section",
        "component.surface",
        "component.eyebrow",
        "component.logo",
        "component.logo-mark"
      ]
    },
    {
      "$schema": "/design-system/schemas/channel.schema.json",
      "schemaVersion": "1.0.0",
      "id": "channel.campaign",
      "name": "Campaign",
      "description": "Paid, organic, event, and launch creative that remains recognisably Wonka at multiple aspect ratios.",
      "aliases": [
        "campaign"
      ],
      "lifecycle": "review_required",
      "stability": "experimental",
      "introducedIn": "0.2.0",
      "allowedThemes": [
        "light",
        "dark"
      ],
      "distribution": "external",
      "tokenSets": [
        "color",
        "semantic.color",
        "typography",
        "motion",
        "radius",
        "component"
      ],
      "compatibleAssetIds": [
        "asset.logo.wordmark",
        "asset.logo.mark",
        "asset.font.inter-display",
        "asset.font.gt-sectra",
        "asset.logo.full",
        "asset.logo.lockup",
        "asset.logo.wordmark-ai",
        "asset.image.color-palette",
        "asset.image.color-plate",
        "asset.image.watermark",
        "asset.image.background",
        "asset.image.avatar",
        "asset.image.logo-card",
        "asset.image.window-icon",
        "asset.image.window-wordmark",
        "asset.image.glass-icon",
        "asset.image.caption-styles",
        "asset.video.logo-reveal",
        "asset.video.icon-loop",
        "asset.video.bar-wipe",
        "asset.video.end-card",
        "asset.video.painted-loop"
      ],
      "constraints": [
        {
          "id": "deterministic-brand-layer",